{
  "contract": "1.0",
  "kind": "suite",
  "name": "fake-faults",
  "defaults": {
    "rungs": [
      "selftest"
    ],
    "engines": [
      "fake-a",
      "fake-far",
      "fake-broken",
      "fake-absent"
    ]
  },
  "runs": [
    {
      "name": "singlet",
      "lens": {
        "kind": "fixture",
        "path": "../../../contract/fixtures/v1/valid/optical-case/singlet.json"
      }
    },
    {
      "name": "double-gauss",
      "lens": {
        "kind": "fixture",
        "path": "../../../contract/fixtures/v1/valid/optical-case/double-gauss.json"
      }
    },
    {
      "name": "missing",
      "lens": {
        "kind": "fixture",
        "path": "cases/missing.json"
      }
    }
  ]
}
